review_title,review_text,review_star,review_date,page
Item as described by the seller. Fast speed. Not bad for money,"Item as described by the seller. Fast speed. Not bad for money, but I will choose a better one in the future.",5.0 out of 5 stars,Reviewed in the United Kingdom on 10 February 2022,4
Competitively priced,"Nice phone, the pink is very subtle. Used the no interest payment plan which was really great and hard to find unlocked monthly plans for this phone elsewhere.",4.0 out of 5 stars,Reviewed in the United Kingdom on 9 January 2022,4
Amazed!!,The phone arrived in greece really quick!Also I'm a first time iphone user and I must say I'm amazed by it!!,5.0 out of 5 stars,Reviewed in the United Kingdom on 9 October 2021,4
Expensive but does the job.,"It's an iPhone and it's very good but Apple continue to charge a huge premium for more storage,",5.0 out of 5 stars,Reviewed in the United Kingdom on 5 January 2022,4
What’s to say It’s and iPhone,"This is my 5th iPhone (13) and to be honest I wouldn’t buy anything else, yes a little expensive but the IOS system is so intuitive and links seamlessly with all my other Apple devices. Still the best Mobile Phone around.",5.0 out of 5 stars,Reviewed in the United Kingdom on 7 February 2022,4
EyeFone,Better than my iPhone X that would die after 29 mins lol,5.0 out of 5 stars,Reviewed in the United Kingdom on 15 December 2021,4
Decent iPhone,Decent iPhone with good camera (excellent night time photos)Good battery life and charging time.Only criticism is you need to buy a plug for charging - penny pinching by apple considering the cost price hence the deduction of 1 star in overall rating.I purchased the Anker Nano USB C Plug for charging which works well.,4.0 out of 5 stars,Reviewed in the United Kingdom on 5 December 2021,2
It’s an iPhone,"As an Android user who didn’t have an iPhone since iPhone 4, I wanted to give it another go and the iOs is definitely a lot better now. Love the battery life on my iPhone 13. You can go a full day of heavy heavy use easily. One thing I don’t understand is that still to this date you cannot send pictures through bluetooth to another phone that is on Android… you will need to either send through Whatsapp (where you lose quality of the photo) or you will have to use and pay for a service such as Amazon Photos or google photos etc. Other than that it’s a really good phone but I hate those silly limitations such as the one above from Apple.",4.0 out of 5 stars,Reviewed in the United Kingdom on 18 December 2021,2
Fantastic battery life better than any other iphone,After my iphone x developed a fault so intermittent it could not be found to be fixed I waited to the release of the iphone 13 as it was only a month away I checked the prices of the iphone 12 and for just £50 extra the obvious winner was the 13 with the new battery capacity I can report battery life is huge and quite often I only use 25%of battery each day and that includes using GPS I honestly now never run low on battery none of that topping up during the day stuff After owning a 4s 5 6s and X this upgrade is the best,5.0 out of 5 stars,Reviewed in the United Kingdom on 26 January 2022,2
Great product & great delivery process,"Sheeple or advocate, I can’t help it, I like apple products. This is no different, an upgrade for my partners phone, an improved camera, almost a revision back to its earlier design, it’s a nice piece of kit.First time I’ve bought a handset from Amazon, having had a high value item go “AWOL” previously I was impressed by the pin delivery where you have to provide the driver with a code to allow them to handover.",5.0 out of 5 stars,Reviewed in the United Kingdom on 10 January 2022,2
Sound issues,"Am I the only one having sound issues? As I’ve not seen other reviews about this. I usually have to put this on loudspeaker and even after I do, most people complain that they can’t hear me or that the sound is cutting out. Outside Amazon reviews, on Google there were some comments about this, so I’m entirely confused if this is particular to my device or others as well. Anyways I have to return it as there is absolutely no significant difference with the 13 from the 12, or 11 as well.",3.0 out of 5 stars,Reviewed in the United Kingdom on 23 January 2022,2
Nothing in the box,"I would have liked to review the iPhone 13 but due to theft/fraud, there wasn’t one in the pare I received. This is a perfectly reasonable review, pointing out that not everything on Amazon is as expected, and the customer service to get my money back s utterly disgraceful.",1.0 out of 5 stars,Reviewed in the United Kingdom on 19 February 2022,2
Slick,"Only purchased after my Xs max was stolen, wanted to wait till iPhone 14 but having said that this version is a definite improvement over my previous model super slick better screen although slightly smaller (not being a max) battery lasts a couple of days between charges, I would say I’m a light to medium user I don’t use Facebook or the likes just a few what’s app messages Apple Music safari surfing & checking my share prices & call the wife on the way home.Have always used apple products for ease of use I have no problem being locked into their ecosystem & have no intention of moving to android.Would definitely recommend this model, just make sure you get a good case to protect it the screen repair prices are painful.",5.0 out of 5 stars,Reviewed in the United Kingdom on 18 March 2022,2
Nice red phone,"Battery life is great <U+0001F44D>, it’s a nice red never had a red phone before, so easy to use and set up, I didn’t get the phone because of the camera I have a camera to take pictures but it’s good to have when you go out, but can’t do too much of that with COVID and the new variant, and it’s 5G I have 5G so thought I would get it, and it’s much lighter than my iPhone 11 so comfortable in my hand, very happy with my new phone",5.0 out of 5 stars,Reviewed in the United Kingdom on 22 December 2021,2
Superb I phone 13,Surprise gift for my wife. She really like the pink colour. I phone 13 is just amazing with awesome picture quality along with great looks. <U+0001F44D>,5.0 out of 5 stars,Reviewed in the United Kingdom on 6 October 2021,2
"That phone, I love it","Excellent piece of kit, great colour, excellent photos. My first Apple phone. I can now understand why people have over them.",5.0 out of 5 stars,Reviewed in the United Kingdom on 12 October 2021,2
Superb,Great product,5.0 out of 5 stars,Reviewed in the United Kingdom on 20 January 2022,7
good,looks great and ez to use,5.0 out of 5 stars,Reviewed in the United Kingdom on 11 March 2022,7
Nice one,I love this phone! Its perfect!,5.0 out of 5 stars,Reviewed in the United Kingdom on 6 December 2021,7
Magnifique!,Personal,5.0 out of 5 stars,Reviewed in the United Kingdom on 6 November 2021,7
rubbish,rubbish,1.0 out of 5 stars,Reviewed in the United Kingdom on 10 March 2022,7
iPhone 13,A+++,5.0 out of 5 stars,Reviewed in the United Kingdom on 23 February 2022,7
very useful,Really like it!,5.0 out of 5 stars,Reviewed in the United Kingdom on 12 January 2022,7
5G battery <U+0001F50B>,"Recently i upgrade to iPhone 13 pro. I have been using this from 5 days. Battery is something I’m not really convinced with it. This is the first time I had this experience I bought a new product and the batter is not really up to the make. May be it’s because of the 5G. But it is bit disappointing, we can’t live in fear we have turn in dark mode, make changes in location, look for videos on YouTube how save battery. Camera quality, built quickly software easy to use iOS15. That’s my honest review about iPhone 13pro 256gb",4.0 out of 5 stars,Reviewed in the United Kingdom on 28 September 2021,7
Buy the iPhone 13 not the max,I bought this as my iPhone 7 stopped working and here are the reasons I bought a iPhone 13 over the pro and max.Apple ui looks so much better than android.You don’t need a better camera when it’s almost twice the price in the pro or max.120hz display isn’t worth the extra price.Smaller phone is better to hold and use than the max.128gb is enough storage for most people.ProsIt’s FastFast charging with 20w charger.Great UINice new camerasBigger screenCan connect external storage5GSmaller notchPicture in PictureSplit screen appsConsNo charger given to you.No Matt coloursNo telephotoNo 6x optical zoomNo night mode scanner4 not 5 GPUSmaller battery than the Pro maxNo Touch ID instead you have stupid Face IDNo promotion displayNo 3rd cameraNo pro resSoftware updates only last for 7 yearsBattery will need replacing after 3 yearsNo usb cAlthough I’ve listed the cons I think the iPhone is still the best phone that you can buy and you will use every day but I’d get the standard iPhone 13 because the max and pro are a rip off the price has become to high for very little extra features compared with the standard phone.And like all smart phones there’s nothing much new each year it’s just new software that improves the features so if you can wait another year buy the iPhone 14 which will possibly have the following.USB cTouch idNo notch screenBattery cameras,4.0 out of 5 stars,Reviewed in the United Kingdom on 24 October 2021,7
Almost perfection.,"Whilst it may be an incremental upgrade over the 12 three key areas have been substantially improved; storage, battery and camera. Face ID still the best. Perfect size - not a slab. It's the overall best phone with a sensibly-sized form factor. The negatives? In an era of 65W charging by the likes Of OnePlus the iPhone charges at a snail's pace - wirelessly it's ridiculously slow. 1200 Htz screen refresh only available on Pro models. Still no USB-C charging. Whilst smaller, the notch is beginning to look ridiculous. No fingerprint reader.",5.0 out of 5 stars,Reviewed in the United Kingdom on 28 December 2021,7
Hanging,"I bought last week from amazon pink one 256, the camera quality is good. But, its just a week and it starts to hang and I don't expect sth like that from Apple phones I have decided to send it back",1.0 out of 5 stars,Reviewed in the United Kingdom on 18 November 2021,5
Absolute quality,I’m an awld fart this is my first new phone and what a phone it is ….highly recommend . Cracking price with a 6 month payment plan. ….buzzing,5.0 out of 5 stars,Reviewed in the United Kingdom on 4 December 2021,5
Good battery life nice size screen and loads of memory,Good battery life nice size screen and loads of memory,5.0 out of 5 stars,Reviewed in the United Kingdom on 31 January 2022,5
Lucky number 13,Love the phone the battery is good but 5g will eat up the battery pretty quickly!,5.0 out of 5 stars,Reviewed in the United Kingdom on 23 October 2021,5
Having a mobile you can rely for n.,Amazon only offered a repair not a replacement. I have lost confidence in this mobile so I hope they don’t send the mobile back has I would like a brand new phone. Lost trust in that old phone only had this since end of November. Not used till 11 December problems with it since out of the box.,1.0 out of 5 stars,Reviewed in the United Kingdom on 5 February 2022,5
iPhone 13 is another great product by Apple,Great picture quality and the colour is amazing,5.0 out of 5 stars,Reviewed in the United Kingdom on 23 October 2021,5
Good value for money as I got 256gb model same price as the 128 gb,Good value for money as I got 256gb model same price as the 128 gb,5.0 out of 5 stars,Reviewed in the United Kingdom on 14 January 2022,5
Iphone,I thought phone was faulty but had it set up by a professional it's now brilliant so please ignore my previous,4.0 out of 5 stars,Reviewed in the United Kingdom on 24 December 2021,5
Gorgeous colour,Lovely pink colour,5.0 out of 5 stars,Reviewed in the United Kingdom on 25 January 2022,5
iPhone 13,Great phone,5.0 out of 5 stars,Reviewed in the United Kingdom on 9 January 2022,5
